{
  "research_version": "1.0",
  "research_name": "regulated_agentic_ai_research_catalog",
  "description": "Function-first research catalog of enterprise AI products/functions, capabilities, and reference implementations for MCP-enabled conversational and agentic AI ecosystems in regulated data industries.",
  "products": [
    {
      "product_name": "evaluation",
      "display_name": "AI Evaluation",
      "domain": "agentic",
      "description": "Evaluates prompts, assistants, agents, tools, workflows and model outputs for quality, safety and reliability.",
      "reference_implementations": [
        {
          "name": "LangSmith",
          "vendor": "LangChain",
          "implementation_type": "commercial",
          "deployment_models": [
            "saas"
          ],
          "url": "https://www.langchain.com/langsmith",
          "notes": "LLM app testing, tracing and evaluation."
        },
        {
          "name": "Promptfoo",
          "vendor": "Promptfoo",
          "implementation_type": "open_source",
          "deployment_models": [
            "self_hosted"
          ],
          "url": "https://www.promptfoo.dev",
          "notes": "Open source LLM evaluation and red teaming framework."
        },
        {
          "name": "OpenAI Evals",
          "vendor": "OpenAI",
          "implementation_type": "open_source",
          "deployment_models": [
            "self_hosted"
          ],
          "url": "https://github.com/openai/evals",
          "notes": "Framework for evaluating LLM behavior."
        },
        {
          "name": "Ragas",
          "vendor": "Exploding Gradients",
          "implementation_type": "open_source",
          "deployment_models": [
            "self_hosted"
          ],
          "url": "https://www.ragas.io",
          "notes": "Evaluation framework for RAG applications."
        },
        {
          "name": "DeepEval",
          "vendor": "Confident AI",
          "implementation_type": "open_source",
          "deployment_models": [
            "self_hosted",
            "saas"
          ],
          "url": "https://www.confident-ai.com",
          "notes": "LLM evaluation framework."
        },
        {
          "name": "Giskard",
          "vendor": "Giskard",
          "implementation_type": "open_source",
          "deployment_models": [
            "self_hosted",
            "saas"
          ],
          "url": "https://www.giskard.ai",
          "notes": "AI testing and evaluation platform."
        },
        {
          "name": "TruLens",
          "vendor": "TruEra",
          "implementation_type": "open_source",
          "deployment_models": [
            "self_hosted"
          ],
          "url": "https://www.trulens.org",
          "notes": "Open source LLM application evaluation framework."
        }
      ],
      "capabilities": [
        {
          "capability_name": "prompt_evaluation",
          "display_name": "Prompt Evaluation",
          "description": "Evaluates prompt quality and behavior.",
          "regulated_relevance": "Supports controlled, governed, reusable enterprise AI adoption.",
          "required": true
        },
        {
          "capability_name": "response_evaluation",
          "display_name": "Response Evaluation",
          "description": "Evaluates AI-generated responses.",
          "regulated_relevance": "Supports controlled, governed, reusable enterprise AI adoption.",
          "required": true
        },
        {
          "capability_name": "rag_evaluation",
          "display_name": "RAG Evaluation",
          "description": "Evaluates retrieval-augmented generation pipelines.",
          "regulated_relevance": "Supports controlled, governed, reusable enterprise AI adoption.",
          "required": true
        },
        {
          "capability_name": "agent_evaluation",
          "display_name": "Agent Evaluation",
          "description": "Evaluates agent workflows and tool use.",
          "regulated_relevance": "Supports controlled, governed, reusable enterprise AI adoption.",
          "required": true
        },
        {
          "capability_name": "regression_testing",
          "display_name": "Regression Testing",
          "description": "Tests for regressions across prompt, model or tool changes.",
          "regulated_relevance": "Supports controlled, governed, reusable enterprise AI adoption.",
          "required": true
        },
        {
          "capability_name": "red_teaming",
          "display_name": "Red Teaming",
          "description": "Tests AI systems for adversarial or unsafe behavior.",
          "regulated_relevance": "Supports controlled, governed, reusable enterprise AI adoption.",
          "required": true
        },
        {
          "capability_name": "groundedness_evaluation",
          "display_name": "Groundedness Evaluation",
          "description": "Evaluates whether outputs are grounded in supplied context or retrieved evidence.",
          "regulated_relevance": "Supports controlled, governed, reusable enterprise AI adoption.",
          "required": true
        },
        {
          "capability_name": "safety_evaluation",
          "display_name": "Safety Evaluation",
          "description": "Evaluates outputs for safety, toxicity, bias and policy violations.",
          "regulated_relevance": "Supports controlled, governed, reusable enterprise AI adoption.",
          "required": true
        }
      ],
      "tags": [
        "evaluation",
        "testing",
        "agentic",
        "quality"
      ]
    },
    {
      "product_name": "execution",
      "display_name": "Agent Execution",
      "domain": "agentic",
      "description": "Executes agent plans, invokes tools, handles intermediate state and produces task outcomes.",
      "reference_implementations": [
        {
          "name": "OpenAI Agents SDK",
          "vendor": "OpenAI",
          "implementation_type": "open_source",
          "deployment_models": [
            "self_hosted",
            "api"
          ],
          "url": "https://openai.github.io/openai-agents-python/",
          "notes": "SDK for agent execution."
        },
        {
          "name": "LangGraph",
          "vendor": "LangChain",
          "implementation_type": "open_source",
          "deployment_models": [
            "self_hosted",
            "managed_cloud"
          ],
          "url": "https://www.langchain.com/langgraph",
          "notes": "Agent execution graph framework."
        },
        {
          "name": "Temporal",
          "vendor": "Temporal",
          "implementation_type": "open_source",
          "deployment_models": [
            "self_hosted",
            "managed_cloud"
          ],
          "url": "https://temporal.io",
          "notes": "Durable workflow execution."
        },
        {
          "name": "Mastra",
          "vendor": "Mastra",
          "implementation_type": "open_source",
          "deployment_models": [
            "self_hosted"
          ],
          "url": "https://mastra.ai",
          "notes": "TypeScript agent framework."
        },
        {
          "name": "Azure AI Foundry Agent Service",
          "vendor": "Microsoft",
          "implementation_type": "cloud_service",
          "deployment_models": [
            "managed_cloud",
            "api"
          ],
          "url": "https://learn.microsoft.com/azure/ai-foundry/agents/",
          "notes": "Managed service for building and running enterprise agents."
        },
        {
          "name": "Google Vertex AI Agent Builder",
          "vendor": "Google",
          "implementation_type": "cloud_service",
          "deployment_models": [
            "managed_cloud"
          ],
          "url": "https://cloud.google.com/products/agent-builder",
          "notes": "Managed platform for building and deploying AI agents."
        }
      ],
      "capabilities": [
        {
          "capability_name": "tool_invocation",
          "display_name": "Tool Invocation",
          "description": "Executes approved tools.",
          "regulated_relevance": "Supports controlled, governed, reusable enterprise AI adoption.",
          "required": true
        },
        {
          "capability_name": "step_execution",
          "display_name": "Step Execution",
          "description": "Executes individual plan steps.",
          "regulated_relevance": "Supports controlled, governed, reusable enterprise AI adoption.",
          "required": true
        },
        {
          "capability_name": "handoff",
          "display_name": "Handoff",
          "description": "Transfers task state between agents, tools or humans.",
          "regulated_relevance": "Supports controlled, governed, reusable enterprise AI adoption.",
          "required": true
        },
        {
          "capability_name": "retry_handling",
          "display_name": "Retry Handling",
          "description": "Retries failed steps according to policy.",
          "regulated_relevance": "Supports controlled, governed, reusable enterprise AI adoption.",
          "required": true
        },
        {
          "capability_name": "result_consolidation",
          "display_name": "Result Consolidation",
          "description": "Combines intermediate results into final outputs.",
          "regulated_relevance": "Supports controlled, governed, reusable enterprise AI adoption.",
          "required": true
        },
        {
          "capability_name": "action_monitoring",
          "display_name": "Action Monitoring",
          "description": "Monitors agent actions and tool invocations during execution.",
          "regulated_relevance": "Supports controlled, governed, reusable enterprise AI adoption.",
          "required": true
        },
        {
          "capability_name": "sandboxed_execution",
          "display_name": "Sandboxed Execution",